{
  "excluded_sources": [
    {
      "path_pattern": ".agent/sidecars/",
      "reason": "private sidecar artifacts are excluded by repo policy"
    },
    {
      "path_pattern": "memory/",
      "reason": "project memory is not part of the public profile pack"
    },
    {
      "path_pattern": "*/.DS_Store",
      "reason": "OS metadata files are never copied into a split repo"
    },
    {
      "path_pattern": "*/__pycache__/*",
      "reason": "compiled bytecode is never copied"
    }
  ],
  "kernel_id": "research-distillation-workflow-contract",
  "kernel_path": "schemas/skill-kernel/examples/research-distillation-workflow-contract.kernel.json",
  "kernel_source_paths": [
    "profiles/profile-index.yaml",
    "profiles/research-distillation/templates/workflow-contract.md",
    "profiles/research-distillation/examples/workflow-contract-routing-evals.json",
    "profiles/research-distillation/examples/workflow-contract-trials/assessment.md"
  ],
  "profile": "research-distillation",
  "profile_index": {
    "destination_path": "profiles/profile-index.yaml",
    "key": "research-distillation",
    "path": "profiles/profile-index.yaml"
  },
  "schema_version": "0.1",
  "sources": [
    {
      "class": "kernel",
      "destination_path": "schemas/skill-kernel/examples/research-distillation-workflow-contract.kernel.json",
      "include_in_split": true,
      "path": "schemas/skill-kernel/examples/research-distillation-workflow-contract.kernel.json",
      "sha256": "sha256:e49d0545c4d784dbbea2bb4a94429da8beb9a790bf5dcc48da2ab90ff5268b08",
      "size_bytes": 7806
    },
    {
      "class": "kernel-source",
      "destination_path": "profiles/profile-index.yaml",
      "include_in_split": true,
      "path": "profiles/profile-index.yaml",
      "sha256": "sha256:c9b642b62dd9712d4f72c9a9c81a85d8b32bb731288b1188cd2bb80639eecc7e",
      "size_bytes": 12249
    },
    {
      "class": "kernel-source",
      "destination_path": "profiles/research-distillation/examples/workflow-contract-routing-evals.json",
      "include_in_split": true,
      "path": "profiles/research-distillation/examples/workflow-contract-routing-evals.json",
      "sha256": "sha256:0a26f0dd11219a57c56cfc310afe82d7c7f332bad33c34461e39680e58add0be",
      "size_bytes": 2725
    },
    {
      "class": "kernel-source",
      "destination_path": "profiles/research-distillation/examples/workflow-contract-trials/assessment.md",
      "include_in_split": true,
      "path": "profiles/research-distillation/examples/workflow-contract-trials/assessment.md",
      "sha256": "sha256:00c38a62ef733a4945246e3c57e8c23d01d5ebc81bf6b3c95d4c14388e0149e8",
      "size_bytes": 2298
    },
    {
      "class": "kernel-source",
      "destination_path": "profiles/research-distillation/templates/workflow-contract.md",
      "include_in_split": true,
      "path": "profiles/research-distillation/templates/workflow-contract.md",
      "sha256": "sha256:829b905575bafe9980aea7494cc517057bdad07e746d7da43bffc78d7d425864",
      "size_bytes": 5568
    },
    {
      "class": "skill-optional",
      "destination_path": "skills/advisor-update-writer/SKILL.md",
      "include_in_split": true,
      "owning_skill": "advisor-update-writer",
      "path": "skills/advisor-update-writer/SKILL.md",
      "sha256": "sha256:4eb0dae854100bfbf911a9acd4e0f0350f6fd7b055e8361176e26f21f81c59c0",
      "size_bytes": 5542
    },
    {
      "class": "skill-optional",
      "destination_path": "skills/advisor-update-writer/references/decision-framing.md",
      "include_in_split": true,
      "owning_skill": "advisor-update-writer",
      "path": "skills/advisor-update-writer/references/decision-framing.md",
      "sha256": "sha256:7dd37dd2e64865a175e9ae25c43dccbd10fd703013612b76f24d81d71d831646",
      "size_bytes": 880
    },
    {
      "class": "skill-optional",
      "destination_path": "skills/advisor-update-writer/references/memory-writeback.md",
      "include_in_split": true,
      "owning_skill": "advisor-update-writer",
      "path": "skills/advisor-update-writer/references/memory-writeback.md",
      "sha256": "sha256:3cf5784e69b4fb7555bd54ee7f9ba576a21e1ae60ccdf25a713f04dcdd8df501",
      "size_bytes": 1075
    },
    {
      "class": "skill-optional",
      "destination_path": "skills/advisor-update-writer/references/update-template.md",
      "include_in_split": true,
      "owning_skill": "advisor-update-writer",
      "path": "skills/advisor-update-writer/references/update-template.md",
      "sha256": "sha256:eae7a561e531a1c12995fb361c5f9a5a523fd31b0100def69cb41a47cb853756",
      "size_bytes": 669
    },
    {
      "class": "skill-optional",
      "destination_path": "skills/paper-writing-assistant/SKILL.md",
      "include_in_split": true,
      "owning_skill": "paper-writing-assistant",
      "path": "skills/paper-writing-assistant/SKILL.md",
      "sha256": "sha256:3f874f647fa0988741db2ce97b85ec36ebc114ce71c2b67b4022c8ff79618c93",
      "size_bytes": 19593
    },
    {
      "class": "skill-optional",
      "destination_path": "skills/paper-writing-assistant/references/edit-whitelist-contract.md",
      "include_in_split": true,
      "owning_skill": "paper-writing-assistant",
      "path": "skills/paper-writing-assistant/references/edit-whitelist-contract.md",
      "sha256": "sha256:b6c55aea300a9c76f1716dcf0def524ef232d26fe2780f621389b7269e817299",
      "size_bytes": 3614
    },
    {
      "class": "skill-optional",
      "destination_path": "skills/paper-writing-assistant/references/evidence-recipes.md",
      "include_in_split": true,
      "owning_skill": "paper-writing-assistant",
      "path": "skills/paper-writing-assistant/references/evidence-recipes.md",
      "sha256": "sha256:c2f0a780b76344b9d9362d0dd4e82e3f9d313d72f6939242ffd83d9794f88b10",
      "size_bytes": 11913
    },
    {
      "class": "skill-optional",
      "destination_path": "skills/paper-writing-assistant/references/exemplar-index.md",
      "include_in_split": true,
      "owning_skill": "paper-writing-assistant",
      "path": "skills/paper-writing-assistant/references/exemplar-index.md",
      "sha256": "sha256:5769859e29a987114515b332d63437af3545a67a423b23fc82e1dea907900707",
      "size_bytes": 4268
    },
    {
      "class": "skill-optional",
      "destination_path": "skills/paper-writing-assistant/references/exemplars/acl-2022-truthfulqa-benchmark.md",
      "include_in_split": true,
      "owning_skill": "paper-writing-assistant",
      "path": "skills/paper-writing-assistant/references/exemplars/acl-2022-truthfulqa-benchmark.md",
      "sha256": "sha256:4b30b29e693acf98d72af90c887bfca7be0aeed435b41e198d1c91cbe513970b",
      "size_bytes": 2037
    },
    {
      "class": "skill-optional",
      "destination_path": "skills/paper-writing-assistant/references/exemplars/cvpr-2022-latent-diffusion-method.md",
      "include_in_split": true,
      "owning_skill": "paper-writing-assistant",
      "path": "skills/paper-writing-assistant/references/exemplars/cvpr-2022-latent-diffusion-method.md",
      "sha256": "sha256:7ff61ecdff8ddada895e5f533241acb8b5e7fd737bc3ad2c4736a4c76ffe3177",
      "size_bytes": 2262
    },
    {
      "class": "skill-optional",
      "destination_path": "skills/paper-writing-assistant/references/exemplars/iccv-2023-segment-anything-benchmark.md",
      "include_in_split": true,
      "owning_skill": "paper-writing-assistant",
      "path": "skills/paper-writing-assistant/references/exemplars/iccv-2023-segment-anything-benchmark.md",
      "sha256": "sha256:9953d6eaab4ac64f7984c75efff310e7ae3afaeafd2b5921b464de515a6640f7",
      "size_bytes": 2069
    },
    {
      "class": "skill-optional",
      "destination_path": "skills/paper-writing-assistant/references/exemplars/iclr-2017-rethinking-generalization-analysis.md",
      "include_in_split": true,
      "owning_skill": "paper-writing-assistant",
      "path": "skills/paper-writing-assistant/references/exemplars/iclr-2017-rethinking-generalization-analysis.md",
      "sha256": "sha256:df50c09edea640aeabe3dd9c5d1cf1efc1d16588107316778da975f76ab52d86",
      "size_bytes": 2001
    },
    {
      "class": "skill-optional",
      "destination_path": "skills/paper-writing-assistant/references/exemplars/iclr-2022-lora-method.md",
      "include_in_split": true,
      "owning_skill": "paper-writing-assistant",
      "path": "skills/paper-writing-assistant/references/exemplars/iclr-2022-lora-method.md",
      "sha256": "sha256:b99498be9d9c5611f6db9be3429257d9baaf0837bd1930bb85acef9f4fd65b61",
      "size_bytes": 2473
    },
    {
      "class": "skill-optional",
      "destination_path": "skills/paper-writing-assistant/references/exemplars/naacl-2019-bert-method.md",
      "include_in_split": true,
      "owning_skill": "paper-writing-assistant",
      "path": "skills/paper-writing-assistant/references/exemplars/naacl-2019-bert-method.md",
      "sha256": "sha256:5c13647af34f0261b300bda0efa796e05500fd7648752a5481a76605cf8f89f1",
      "size_bytes": 2120
    },
    {
      "class": "skill-optional",
      "destination_path": "skills/paper-writing-assistant/references/exemplars/neurips-2020-ddpm-method.md",
      "include_in_split": true,
      "owning_skill": "paper-writing-assistant",
      "path": "skills/paper-writing-assistant/references/exemplars/neurips-2020-ddpm-method.md",
      "sha256": "sha256:1af384960041c7a8e8e2a168518b3ae9f3e2cc7d79483b546b8adb9dc51541f8",
      "size_bytes": 2194
    },
    {
      "class": "skill-optional",
      "destination_path": "skills/paper-writing-assistant/references/exemplars/neurips-2021-mlp-mixer-method.md",
      "include_in_split": true,
      "owning_skill": "paper-writing-assistant",
      "path": "skills/paper-writing-assistant/references/exemplars/neurips-2021-mlp-mixer-method.md",
      "sha256": "sha256:9f0a69e5c4f8e1be0c574b66485f7210d8dec1274ed2b77cc21ce7ce14e0afd9",
      "size_bytes": 2069
    },
    {
      "class": "skill-optional",